"ID","Gemeinde_color","Ja_Stimmen_In_Prozent","Nein_Stimmen_In_Prozent","Gemeinde_de","Text_de"
3001,52.3,52.3,47.7,"Herisau AR","Ja zur Initiative für eine 13. AHV-Rente in Herisau. Die Gemeinde hat das Volksbegehren mit 52,3 Prozent der Stimmen angenommen. Herisau hat damit gleich wie der Kanton Appenzell Ausserrhoden Ja gesagt zu dieser Vorlage."
3002,70,70,30,"Hundwil AR","70 Prozent der Stimmbürgerinnen und Stimmbürger von Hundwil haben die Initiative für eine 13. AHV-Rente angenommen. Hundwil hat damit gleich wie der Kanton Appenzell Ausserrhoden Ja gesagt zu dieser Vorlage."
3003,57.1,57.1,42.9,"Schönengrund AR","Die Stimmbevölkerung von Schönengrund hat die Initiative für eine 13. AHV-Rente mit 57,1 Prozent angenommen. Schönengrund hat damit gleich wie der Kanton Appenzell Ausserrhoden Ja gesagt zu dieser Vorlage."
3004,94,94,6,"Schwellbrunn AR","Die Gemeinde Schwellbrunn hat die Initiative für eine 13. AHV-Rente mit 94 Prozent Ja-Stimmen angenommen. Schwellbrunn hat damit bei dieser Vorlage den höchsten Ja-Anteil im Kanton Appenzell Ausserrhoden."
3005,59.5,59.5,40.5,"Stein AR","Die Stimmbevölkerung von Stein AR hat die Initiative für eine 13. AHV-Rente mit 59,5 Prozent angenommen. Stein AR hat damit gleich wie der Kanton Appenzell Ausserrhoden Ja gesagt zu dieser Vorlage."
3006,74.3,74.3,25.7,"Urnäsch AR","Die Gemeinde Urnäsch hat die Initiative für eine 13. AHV-Rente mit 74,3 Prozent Ja-Stimmen angenommen. Urnäsch hat damit gleich wie der Kanton Appenzell Ausserrhoden Ja gesagt zu dieser Vorlage."
3007,47.1,47.1,52.9,"Waldstatt AR","Keine Mehrheit für die Initiative für eine 13. AHV-Rente in Waldstatt: Mit 6'628 Nein-Stimmen zu 5'897 Ja-Stimmen oder 52,9 Prozent hat die Gemeinde das Volksbegehren verworfen. Waldstatt hat damit anders abgestimmt als der Kanton Appenzell Ausserrhoden, der die Vorlage angenommen hat."
3021,58.8,58.8,41.2,"Bühler AR","58,8 Prozent der Stimmbürgerinnen und Stimmbürger von Bühler haben die Initiative für eine 13. AHV-Rente angenommen. Bühler hat damit gleich wie der Kanton Appenzell Ausserrhoden Ja gesagt zu dieser Vorlage."
3022,37.7,37.7,62.3,"Gais AR","In Gais hat die Stimmbevölkerung die Initiative für eine 13. AHV-Rente abgelehnt. Das Volksbegehren wurde mit einem Nein-Stimmen-Anteil von 62,3 Prozent verworfen. Gais hat damit anders abgestimmt als der Kanton Appenzell Ausserrhoden, der die Vorlage angenommen hat."
3023,8.9,8.9,91.1,"Speicher AR","Nein zur Initiative für eine 13. AHV-Rente in Speicher: Mit 3'344 Nein- zu 326 Ja-Stimmen haben die Stimmbürgerinnen und Stimmbürger das Volksbegehren abgelehnt. Das sind 91,1 Prozent. Speicher hat damit bei dieser Vorlage den höchsten Nein-Anteil im Kanton Appenzell Ausserrhoden."
3024,90.3,90.3,9.7,"Teufen AR","Die Stimmbevölkerung von Teufen AR hat die Initiative für eine 13. AHV-Rente mit 90,3 Prozent angenommen. Teufen AR hat damit gleich wie der Kanton Appenzell Ausserrhoden Ja gesagt zu dieser Vorlage."
3025,17.2,17.2,82.8,"Trogen AR","In Trogen hat die Initiative für eine 13. AHV-Rente keine Mehrheit gefunden. Auf 82,8 Prozent der abgegebenen Stimmzettel stand ein Nein. Trogen hat damit anders abgestimmt als der Kanton Appenzell Ausserrhoden, der die Vorlage angenommen hat."
3031,58.8,58.8,41.2,"Grub AR","Ja zur Initiative für eine 13. AHV-Rente in Grub AR. Die Gemeinde hat das Volksbegehren mit 58,8 Prozent der Stimmen angenommen. Grub AR hat damit gleich wie der Kanton Appenzell Ausserrhoden Ja gesagt zu dieser Vorlage."
3032,43.6,43.6,56.4,"Heiden AR","Nein zur Initiative für eine 13. AHV-Rente in Heiden: Mit 1'346 Nein- zu 1'040 Ja-Stimmen haben die Stimmbürgerinnen und Stimmbürger das Volksbegehren abgelehnt. Das sind 56,4 Prozent. Heiden hat damit anders abgestimmt als der Kanton Appenzell Ausserrhoden, der die Vorlage angenommen hat."
3033,50.4,50.4,49.6,"Lutzenberg AR","In Lutzenberg hat die Stimmbevölkerung der Initiative für eine 13. AHV-Rente zugestimmt. Sie wurde mit einem Ja-Stimmen-Anteil von 50,4 Prozent angenommen. Lutzenberg hat damit gleich wie der Kanton Appenzell Ausserrhoden Ja gesagt zu dieser Vorlage."
3034,55.9,55.9,44.1,"Rehetobel AR","In Rehetobel hat die Stimmbevölkerung der Initiative für eine 13. AHV-Rente zugestimmt. Sie wurde mit einem Ja-Stimmen-Anteil von 55,9 Prozent angenommen. Rehetobel hat damit gleich wie der Kanton Appenzell Ausserrhoden Ja gesagt zu dieser Vorlage."
3035,49.8,49.8,50.2,"Reute AR","Nein zu einer 13. AHV-Rente in Reute AR. Die Gemeinde hat die Initiative mit 50,2 Prozent abgelehnt. Reute AR hat damit anders abgestimmt als der Kanton Appenzell Ausserrhoden, der die Vorlage angenommen hat."
3036,42.4,42.4,57.6,"Wald AR","Keine Mehrheit für die Initiative für eine 13. AHV-Rente in Wald AR: Mit 5'953 Nein-Stimmen zu 4'382 Ja-Stimmen oder 57,6 Prozent hat die Gemeinde das Volksbegehren verworfen. Wald AR hat damit anders abgestimmt als der Kanton Appenzell Ausserrhoden, der die Vorlage angenommen hat."
3037,54.4,54.4,45.6,"Walzenhausen AR","Die Stimmbevölkerung von Walzenhausen hat die Initiative für eine 13. AHV-Rente mit 54,4 Prozent angenommen. Walzenhausen hat damit gleich wie der Kanton Appenzell Ausserrhoden Ja gesagt zu dieser Vorlage."
3038,45.7,45.7,54.3,"Wolfhalden AR","Nein zur Initiative für eine 13. AHV-Rente in Wolfhalden: Mit 9'893 Nein- zu 8'332 Ja-Stimmen haben die Stimmbürgerinnen und Stimmbürger das Volksbegehren abgelehnt. Das sind 54,3 Prozent. Wolfhalden hat damit anders abgestimmt als der Kanton Appenzell Ausserrhoden, der die Vorlage angenommen hat."
3101,74.6,74.6,25.4,"Appenzell AI","Ja zur Initiative für eine 13. AHV-Rente in Appenzell: Mit 74,6 Prozent haben die Stimmbürgerinnen und Stimmbürger das Volksbegehren angenommen. Appenzell hat damit bei dieser Vorlage den höchsten Ja-Anteil im Kanton Appenzell Innerrhoden."
3102,12.2,12.2,87.8,"Gonten AI","Keine Mehrheit für die Initiative für eine 13. AHV-Rente in Gonten: Mit 9'318 Nein-Stimmen zu 1'295 Ja-Stimmen oder 87,8 Prozent hat die Gemeinde das Volksbegehren verworfen. Gonten hat damit bei dieser Vorlage den höchsten Nein-Anteil im Kanton Appenzell Innerrhoden."
3104,29.3,29.3,70.7,"Schlatt-Haslen AI","In Schlatt-Haslen hat die Stimmbevölkerung die Initiative für eine 13. AHV-Rente abgelehnt. Das Volksbegehren wurde mit einem Nein-Stimmen-Anteil von 70,7 Prozent verworfen. Schlatt-Haslen hat damit gleich wie der Kanton Appenzell Innerrhoden Nein gesagt zu dieser Vorlage."
3111,68.5,68.5,31.5,"Oberegg AI","In Oberegg hat die Stimmbevölkerung der Initiative für eine 13. AHV-Rente zugestimmt. Sie wurde mit einem Ja-Stimmen-Anteil von 68,5 Prozent angenommen. Oberegg hat damit anders abgestimmt als der Kanton Appenzell Innerrhoden, der die Vorlage abgelehnt hat."
3112,29,29,71,"Schwende-Rüti AI","Schwende-Rüti hat die Initiative für eine 13. AHV-Rente mit 71 Prozent abgelehnt. Schwende-Rüti hat damit gleich wie der Kanton Appenzell Innerrhoden Nein gesagt zu dieser Vorlage."
