"ID","Gemeinde_color","Ja_Stimmen_In_Prozent","Nein_Stimmen_In_Prozent","Gemeinde_de","Text_de"
3001,34.4,34.4,65.6,"Herisau AR","Herisau hat die Renteninitiative mit 65,6 Prozent abgelehnt. Herisau hat damit anders abgestimmt als der Kanton Appenzell Ausserrhoden, der die Vorlage angenommen hat."
3002,95.4,95.4,4.6,"Hundwil AR","95,4 Prozent der Stimmbürgerinnen und Stimmbürger von Hundwil haben die Renteninitiative angenommen. Hundwil hat damit bei dieser Vorlage den höchsten Ja-Anteil im Kanton Appenzell Ausserrhoden."
3003,50.1,50.1,49.9,"Schönengrund AR","Die Gemeinde Schönengrund hat die Renteninitiative mit 50,1 Prozent angenommen. Schönengrund hat damit gleich wie der Kanton Appenzell Ausserrhoden Ja gesagt zu dieser Vorlage."
3004,63.9,63.9,36.1,"Schwellbrunn AR","Die Gemeinde Schwellbrunn hat die Renteninitiative mit 63,9 Prozent Ja-Stimmen angenommen. Schwellbrunn hat damit gleich wie der Kanton Appenzell Ausserrhoden Ja gesagt zu dieser Vorlage."
3005,42.1,42.1,57.9,"Stein AR","Nein zur Renteninitiative in Stein AR mit 57,9 Prozent Ablehnung. Stein AR hat damit anders abgestimmt als der Kanton Appenzell Ausserrhoden, der die Vorlage angenommen hat."
3006,88.8,88.8,11.2,"Urnäsch AR","Die Gemeinde Urnäsch hat die Renteninitiative mit 88,8 Prozent Ja-Stimmen angenommen. Urnäsch hat damit gleich wie der Kanton Appenzell Ausserrhoden Ja gesagt zu dieser Vorlage."
3007,58.6,58.6,41.4,"Waldstatt AR","58,6 Prozent der Abstimmenden in der Gemeinde Waldstatt haben Ja gesagt zur Renteninitiative. Waldstatt hat damit gleich wie der Kanton Appenzell Ausserrhoden Ja gesagt zu dieser Vorlage."
3021,56.1,56.1,43.9,"Bühler AR","56,1 Prozent der Stimmbürgerinnen und Stimmbürger von Bühler haben die Renteninitiative angenommen. Bühler hat damit gleich wie der Kanton Appenzell Ausserrhoden Ja gesagt zu dieser Vorlage."
3022,65.9,65.9,34.1,"Gais AR","In Gais hat die Stimmbevölkerung der Renteninitiative zugestimmt. Sie wurde mit einem Ja-Stimmen-Anteil von 65,9 Prozent angenommen. Gais hat damit gleich wie der Kanton Appenzell Ausserrhoden Ja gesagt zu dieser Vorlage."
3023,57.9,57.9,42.1,"Speicher AR","57,9 Prozent der Stimmbürgerinnen und Stimmbürger von Speicher haben die Renteninitiative angenommen. Speicher hat damit gleich wie der Kanton Appenzell Ausserrhoden Ja gesagt zu dieser Vorlage."
3024,25.8,25.8,74.2,"Teufen AR","Nein zur Renteninitiative in Teufen AR mit 74,2 Prozent Ablehnung. Teufen AR hat damit anders abgestimmt als der Kanton Appenzell Ausserrhoden, der die Vorlage angenommen hat."
3025,33.2,33.2,66.8,"Trogen AR","In Trogen hat die Renteninitiative keine Mehrheit gefunden. Auf 66,8 Prozent der abgegebenen Stimmzettel stand ein Nein. Trogen hat damit anders abgestimmt als der Kanton Appenzell Ausserrhoden, der die Vorlage angenommen hat."
3031,12.5,12.5,87.5,"Grub AR","Grub AR hat die Renteninitiative mit 87,5 Prozent abgelehnt. Grub AR hat damit anders abgestimmt als der Kanton Appenzell Ausserrhoden, der die Vorlage angenommen hat."
3032,3.6,3.6,96.4,"Heiden AR","Nein zur Renteninitiative in Heiden: Mit 96,4 Prozent haben die Stimmbürgerinnen und Stimmbürger das Volksbegehren abgelehnt. Heiden hat damit anders abgestimmt als der Kanton Appenzell Ausserrhoden, der die Vorlage angenommen hat."
3033,42,42,58,"Lutzenberg AR","In Lutzenberg hat die Stimmbevölkerung die Renteninitiative abgelehnt. Das Volksbegehren wurde mit einem Nein-Stimmen-Anteil von 58 Prozent verworfen. Lutzenberg hat damit anders abgestimmt als der Kanton Appenzell Ausserrhoden, der die Vorlage angenommen hat."
3034,47,47,53,"Rehetobel AR","In Rehetobel hat die Stimmbevölkerung die Renteninitiative abgelehnt. Das Volksbegehren wurde mit einem Nein-Stimmen-Anteil von 53 Prozent verworfen. Rehetobel hat damit anders abgestimmt als der Kanton Appenzell Ausserrhoden, der die Vorlage angenommen hat."
3035,79.7,79.7,20.3,"Reute AR","Die Gemeinde Reute AR hat die Renteninitiative mit 79,7 Prozent angenommen. Reute AR hat damit gleich wie der Kanton Appenzell Ausserrhoden Ja gesagt zu dieser Vorlage."
3036,1.6,1.6,98.4,"Wald AR","Keine Mehrheit für die Renteninitiative in Wald AR: Mit 5'770 Nein-Stimmen zu 92 Ja-Stimmen oder 98,4 Prozent hat die Gemeinde das Volksbegehren verworfen. Wald AR hat damit bei dieser Vorlage den höchsten Nein-Anteil im Kanton Appenzell Ausserrhoden."
3037,56.1,56.1,43.9,"Walzenhausen AR","Die Gemeinde Walzenhausen hat die Renteninitiative mit 56,1 Prozent angenommen. Walzenhausen hat damit gleich wie der Kanton Appenzell Ausserrhoden Ja gesagt zu dieser Vorlage."
3038,2.9,2.9,97.1,"Wolfhalden AR","Nein zur Renteninitiative in Wolfhalden: Mit 97,1 Prozent haben die Stimmbürgerinnen und Stimmbürger das Volksbegehren abgelehnt. Wolfhalden hat damit anders abgestimmt als der Kanton Appenzell Ausserrhoden, der die Vorlage angenommen hat."
3101,88.7,88.7,11.3,"Appenzell AI","Ja zur Renteninitiative in Appenzell: Mit 88,7 Prozent haben die Stimmbürgerinnen und Stimmbürger das Volksbegehren angenommen. Appenzell hat damit bei dieser Vorlage den höchsten Ja-Anteil im Kanton Appenzell Innerrhoden."
3102,47,47,53,"Gonten AI","Keine Mehrheit für die Renteninitiative in Gonten: Mit 4'197 Nein-Stimmen zu 3'729 Ja-Stimmen oder 53 Prozent hat die Gemeinde das Volksbegehren verworfen. Gonten hat damit gleich wie der Kanton Appenzell Innerrhoden Nein gesagt zu dieser Vorlage."
3104,28.4,28.4,71.6,"Schlatt-Haslen AI","In Schlatt-Haslen hat die Stimmbevölkerung die Renteninitiative abgelehnt. Das Volksbegehren wurde mit einem Nein-Stimmen-Anteil von 71,6 Prozent verworfen. Schlatt-Haslen hat damit bei dieser Vorlage den höchsten Nein-Anteil im Kanton Appenzell Innerrhoden."
3111,45.1,45.1,54.9,"Oberegg AI","In Oberegg hat die Stimmbevölkerung die Renteninitiative abgelehnt. Das Volksbegehren wurde mit einem Nein-Stimmen-Anteil von 54,9 Prozent verworfen. Oberegg hat damit gleich wie der Kanton Appenzell Innerrhoden Nein gesagt zu dieser Vorlage."
3112,87,87,13,"Schwende-Rüti AI","Ja zur Renteninitiative in Schwende-Rüti. Die Gemeinde hat das Volksbegehren mit 87 Prozent der Stimmen angenommen. Schwende-Rüti hat damit anders abgestimmt als der Kanton Appenzell Innerrhoden, der die Vorlage abgelehnt hat."
