"ID","Gemeinde_color","Ja_Stimmen_In_Prozent","Nein_Stimmen_In_Prozent","Gemeinde_de","Text_de"
3001,36.9,36.9,63.1,"Herisau AR","Herisau hat die Renteninitiative mit 63,1 Prozent abgelehnt. Herisau hat damit anders abgestimmt als der Kanton Appenzell Ausserrhoden, der die Vorlage angenommen hat."
3002,78.2,78.2,21.8,"Hundwil AR","78,2 Prozent der Stimmbürgerinnen und Stimmbürger von Hundwil haben die Renteninitiative angenommen. Hundwil hat damit gleich wie der Kanton Appenzell Ausserrhoden Ja gesagt zu dieser Vorlage."
3003,8.2,8.2,91.8,"Schönengrund AR","Nein zur Renteninitiative in Schönengrund mit 91,8 Prozent Ablehnung. Schönengrund hat damit anders abgestimmt als der Kanton Appenzell Ausserrhoden, der die Vorlage angenommen hat."
3004,29.5,29.5,70.5,"Schwellbrunn AR","In Schwellbrunn hat die Renteninitiative keine Mehrheit gefunden. Auf 70,5 Prozent der abgegebenen Stimmzettel stand ein Nein. Schwellbrunn hat damit anders abgestimmt als der Kanton Appenzell Ausserrhoden, der die Vorlage angenommen hat."
3005,79,79,21,"Stein AR","Die Gemeinde Stein AR hat die Renteninitiative mit 79 Prozent angenommen. Stein AR hat damit gleich wie der Kanton Appenzell Ausserrhoden Ja gesagt zu dieser Vorlage."
3006,94.2,94.2,5.8,"Urnäsch AR","Die Gemeinde Urnäsch hat die Renteninitiative mit 94,2 Prozent Ja-Stimmen angenommen. Urnäsch hat damit bei dieser Vorlage den höchsten Ja-Anteil im Kanton Appenzell Ausserrhoden."
3007,31.6,31.6,68.4,"Waldstatt AR","Keine Mehrheit für die Renteninitiative in Waldstatt: Mit 4'026 Nein-Stimmen zu 1'864 Ja-Stimmen oder 68,4 Prozent hat die Gemeinde das Volksbegehren verworfen. Waldstatt hat damit anders abgestimmt als der Kanton Appenzell Ausserrhoden, der die Vorlage angenommen hat."
3021,55.4,55.4,44.6,"Bühler AR","55,4 Prozent der Stimmbürgerinnen und Stimmbürger von Bühler haben die Renteninitiative angenommen. Bühler hat damit gleich wie der Kanton Appenzell Ausserrhoden Ja gesagt zu dieser Vorlage."
3022,38.8,38.8,61.2,"Gais AR","In Gais hat die Stimmbevölkerung die Renteninitiative abgelehnt. Das Volksbegehren wurde mit einem Nein-Stimmen-Anteil von 61,2 Prozent verworfen. Gais hat damit anders abgestimmt als der Kanton Appenzell Ausserrhoden, der die Vorlage angenommen hat."
3023,47.7,47.7,52.3,"Speicher AR","Nein zur Renteninitiative in Speicher: Mit 52,3 Prozent haben die Stimmbürgerinnen und Stimmbürger das Volksbegehren abgelehnt. Speicher hat damit anders abgestimmt als der Kanton Appenzell Ausserrhoden, der die Vorlage angenommen hat."
3024,38.1,38.1,61.9,"Teufen AR","Nein zur Renteninitiative in Teufen AR mit 61,9 Prozent Ablehnung. Teufen AR hat damit anders abgestimmt als der Kanton Appenzell Ausserrhoden, der die Vorlage angenommen hat."
3025,7,7,93,"Trogen AR","In Trogen hat die Renteninitiative keine Mehrheit gefunden. Auf 93 Prozent der abgegebenen Stimmzettel stand ein Nein. Trogen hat damit bei dieser Vorlage den höchsten Nein-Anteil im Kanton Appenzell Ausserrhoden."
3031,38.5,38.5,61.5,"Grub AR","Grub AR hat die Renteninitiative mit 61,5 Prozent abgelehnt. Grub AR hat damit anders abgestimmt als der Kanton Appenzell Ausserrhoden, der die Vorlage angenommen hat."
3032,38.5,38.5,61.5,"Heiden AR","Nein zur Renteninitiative in Heiden: Mit 61,5 Prozent haben die Stimmbürgerinnen und Stimmbürger das Volksbegehren abgelehnt. Heiden hat damit anders abgestimmt als der Kanton Appenzell Ausserrhoden, der die Vorlage angenommen hat."
3033,52.8,52.8,47.2,"Lutzenberg AR","In Lutzenberg hat die Stimmbevölkerung der Renteninitiative zugestimmt. Sie wurde mit einem Ja-Stimmen-Anteil von 52,8 Prozent angenommen. Lutzenberg hat damit gleich wie der Kanton Appenzell Ausserrhoden Ja gesagt zu dieser Vorlage."
3034,65,65,35,"Rehetobel AR","In Rehetobel hat die Stimmbevölkerung der Renteninitiative zugestimmt. Sie wurde mit einem Ja-Stimmen-Anteil von 65 Prozent angenommen. Rehetobel hat damit gleich wie der Kanton Appenzell Ausserrhoden Ja gesagt zu dieser Vorlage."
3035,73.6,73.6,26.4,"Reute AR","Die Gemeinde Reute AR hat die Renteninitiative mit 73,6 Prozent angenommen. Reute AR hat damit gleich wie der Kanton Appenzell Ausserrhoden Ja gesagt zu dieser Vorlage."
3036,35.6,35.6,64.4,"Wald AR","Keine Mehrheit für die Renteninitiative in Wald AR: Mit 9'857 Nein-Stimmen zu 5'441 Ja-Stimmen oder 64,4 Prozent hat die Gemeinde das Volksbegehren verworfen. Wald AR hat damit anders abgestimmt als der Kanton Appenzell Ausserrhoden, der die Vorlage angenommen hat."
3037,34.7,34.7,65.3,"Walzenhausen AR","Nein zur Renteninitiative in Walzenhausen mit 65,3 Prozent Ablehnung. Walzenhausen hat damit anders abgestimmt als der Kanton Appenzell Ausserrhoden, der die Vorlage angenommen hat."
3038,90.2,90.2,9.8,"Wolfhalden AR","90,2 Prozent der Stimmbürgerinnen und Stimmbürger von Wolfhalden haben die Renteninitiative angenommen. Wolfhalden hat damit gleich wie der Kanton Appenzell Ausserrhoden Ja gesagt zu dieser Vorlage."
3101,32.4,32.4,67.6,"Appenzell AI","67,6 Prozent der Stimmbürgerinnen und Stimmbürger von Appenzell sagen Nein zur Renteninitiative. Appenzell hat damit bei dieser Vorlage den höchsten Nein-Anteil im Kanton Appenzell Innerrhoden."
3102,49.7,49.7,50.3,"Gonten AI","Keine Mehrheit für die Renteninitiative in Gonten: Mit 7'585 Nein-Stimmen zu 7'493 Ja-Stimmen oder 50,3 Prozent hat die Gemeinde das Volksbegehren verworfen. Gonten hat damit anders abgestimmt als der Kanton Appenzell Innerrhoden, der die Vorlage angenommen hat."
3104,60.8,60.8,39.2,"Schlatt-Haslen AI","In Schlatt-Haslen hat die Stimmbevölkerung der Renteninitiative zugestimmt. Sie wurde mit einem Ja-Stimmen-Anteil von 60,8 Prozent angenommen. Schlatt-Haslen hat damit bei dieser Vorlage den höchsten Ja-Anteil im Kanton Appenzell Innerrhoden."
3111,42.6,42.6,57.4,"Oberegg AI","In Oberegg hat die Stimmbevölkerung die Renteninitiative abgelehnt. Das Volksbegehren wurde mit einem Nein-Stimmen-Anteil von 57,4 Prozent verworfen. Oberegg hat damit anders abgestimmt als der Kanton Appenzell Innerrhoden, der die Vorlage angenommen hat."
3112,44.3,44.3,55.7,"Schwende-Rüti AI","Schwende-Rüti hat die Renteninitiative mit 55,7 Prozent abgelehnt. Schwende-Rüti hat damit anders abgestimmt als der Kanton Appenzell Innerrhoden, der die Vorlage angenommen hat."
