"ID","Gemeinde_color","Ja_Stimmen_In_Prozent","Nein_Stimmen_In_Prozent","Gemeinde_de","Text_de"
3101,54.3,54.3,45.7,"Appenzell AI","Ja zur Renteninitiative in Appenzell: Mit 54,3 Prozent haben die Stimmbürgerinnen und Stimmbürger das Volksbegehren angenommen. Appenzell hat damit gleich wie der Kanton Appenzell Innerrhoden Ja gesagt zu dieser Vorlage."
3102,44.4,44.4,55.6,"Gonten AI","Keine Mehrheit für die Renteninitiative in Gonten: Mit 5'125 Nein-Stimmen zu 4'100 Ja-Stimmen oder 55,6 Prozent hat die Gemeinde das Volksbegehren verworfen. Gonten hat damit anders abgestimmt als der Kanton Appenzell Innerrhoden, der die Vorlage angenommen hat."
3104,35.7,35.7,64.3,"Schlatt-Haslen AI","In Schlatt-Haslen hat die Stimmbevölkerung die Renteninitiative abgelehnt. Das Volksbegehren wurde mit einem Nein-Stimmen-Anteil von 64,3 Prozent verworfen. Schlatt-Haslen hat damit anders abgestimmt als der Kanton Appenzell Innerrhoden, der die Vorlage angenommen hat."
3111,61.8,61.8,38.2,"Oberegg AI","In Oberegg hat die Stimmbevölkerung der Renteninitiative zugestimmt. Sie wurde mit einem Ja-Stimmen-Anteil von 61,8 Prozent angenommen. Oberegg hat damit bei dieser Vorlage den höchsten Ja-Anteil im Kanton Appenzell Innerrhoden."
3112,30.7,30.7,69.3,"Schwende-Rüti AI","Schwende-Rüti hat die Renteninitiative mit 69,3 Prozent abgelehnt. Schwende-Rüti hat damit bei dieser Vorlage den höchsten Nein-Anteil im Kanton Appenzell Innerrhoden."
