"ID","Gemeinde_color","Ja_Stimmen_In_Prozent","Nein_Stimmen_In_Prozent","Gemeinde_de","Text_de"
3101,76,76,24,"Appenzell AI","Ja zur Renteninitiative in Appenzell: Mit 76 Prozent haben die Stimmbürgerinnen und Stimmbürger das Volksbegehren angenommen. Appenzell hat damit gleich wie der Kanton Appenzell Innerrhoden Ja gesagt zu dieser Vorlage."
3102,22.6,22.6,77.4,"Gonten AI","Keine Mehrheit für die Renteninitiative in Gonten: Mit 9'736 Nein-Stimmen zu 2'849 Ja-Stimmen oder 77,4 Prozent hat die Gemeinde das Volksbegehren verworfen. Gonten hat damit anders abgestimmt als der Kanton Appenzell Innerrhoden, der die Vorlage angenommen hat."
3104,1.8,1.8,98.2,"Schlatt-Haslen AI","In Schlatt-Haslen hat die Stimmbevölkerung die Renteninitiative abgelehnt. Das Volksbegehren wurde mit einem Nein-Stimmen-Anteil von 98,2 Prozent verworfen. Schlatt-Haslen hat damit bei dieser Vorlage den höchsten Nein-Anteil im Kanton Appenzell Innerrhoden."
3111,81.1,81.1,18.9,"Oberegg AI","In Oberegg hat die Stimmbevölkerung der Renteninitiative zugestimmt. Sie wurde mit einem Ja-Stimmen-Anteil von 81,1 Prozent angenommen. Oberegg hat damit gleich wie der Kanton Appenzell Innerrhoden Ja gesagt zu dieser Vorlage."
3112,92.8,92.8,7.2,"Schwende-Rüti AI","Ja zur Renteninitiative in Schwende-Rüti. Die Gemeinde hat das Volksbegehren mit 92,8 Prozent der Stimmen angenommen. Schwende-Rüti hat damit bei dieser Vorlage den höchsten Ja-Anteil im Kanton Appenzell Innerrhoden."
