"Gemeinde_Nr","Gemeinde_color","Ja_Stimmen_In_Prozent","Nein_Stimmen_In_Prozent","Gemeinde_de","Text_de"
3101,50.2,50.2,49.8,"Appenzell AI","Ja zur Initiative für eine 13. AHV-Rente in Appenzell: Mit 50,2 Prozent haben die Stimmbürgerinnen und Stimmbürger das Volksbegehren angenommen. Appenzell hat damit anders abgestimmt als der Kanton Appenzell Innerrhoden, der die Vorlage abgelehnt hat."
3102,71.9,71.9,28.1,"Gonten AI","71,9 Prozent der Abstimmenden in der Gemeinde Gonten haben Ja gesagt zur Initiative für eine 13. AHV-Rente. Gonten hat damit bei dieser Vorlage den höchsten Ja-Anteil im Kanton Appenzell Innerrhoden."
3104,4.5,4.5,95.5,"Schlatt-Haslen AI","In Schlatt-Haslen hat die Stimmbevölkerung die Initiative für eine 13. AHV-Rente abgelehnt. Das Volksbegehren wurde mit einem Nein-Stimmen-Anteil von 95,5 Prozent verworfen. Schlatt-Haslen hat damit bei dieser Vorlage den höchsten Nein-Anteil im Kanton Appenzell Innerrhoden."
3111,22.3,22.3,77.7,"Oberegg AI","In Oberegg hat die Stimmbevölkerung die Initiative für eine 13. AHV-Rente abgelehnt. Das Volksbegehren wurde mit einem Nein-Stimmen-Anteil von 77,7 Prozent verworfen. Oberegg hat damit gleich wie der Kanton Appenzell Innerrhoden Nein gesagt zu dieser Vorlage."
3112,36.5,36.5,63.5,"Schwende-Rüti AI","Schwende-Rüti hat die Initiative für eine 13. AHV-Rente mit 63,5 Prozent abgelehnt. Schwende-Rüti hat damit gleich wie der Kanton Appenzell Innerrhoden Nein gesagt zu dieser Vorlage."
