"ID","Gemeinde_color","Ja_Stimmen_In_Prozent","Nein_Stimmen_In_Prozent","Gemeinde_de","Text_de"
3101,26,26,74,"Appenzell AI","74 Prozent der Stimmbürgerinnen und Stimmbürger von Appenzell sagen Nein zur Initiative für eine 13. AHV-Rente. Appenzell hat damit gleich wie der Kanton Appenzell Innerrhoden Nein gesagt zu dieser Vorlage."
3102,85.4,85.4,14.6,"Gonten AI","85,4 Prozent der Abstimmenden in der Gemeinde Gonten haben Ja gesagt zur Initiative für eine 13. AHV-Rente. Gonten hat damit bei dieser Vorlage den höchsten Ja-Anteil im Kanton Appenzell Innerrhoden."
3104,21.9,21.9,78.1,"Schlatt-Haslen AI","In Schlatt-Haslen hat die Stimmbevölkerung die Initiative für eine 13. AHV-Rente abgelehnt. Das Volksbegehren wurde mit einem Nein-Stimmen-Anteil von 78,1 Prozent verworfen. Schlatt-Haslen hat damit bei dieser Vorlage den höchsten Nein-Anteil im Kanton Appenzell Innerrhoden."
3111,62.2,62.2,37.8,"Oberegg AI","In Oberegg hat die Stimmbevölkerung der Initiative für eine 13. AHV-Rente zugestimmt. Sie wurde mit einem Ja-Stimmen-Anteil von 62,2 Prozent angenommen. Oberegg hat damit anders abgestimmt als der Kanton Appenzell Innerrhoden, der die Vorlage abgelehnt hat."
3112,70.4,70.4,29.6,"Schwende-Rüti AI","Ja zur Initiative für eine 13. AHV-Rente in Schwende-Rüti. Die Gemeinde hat das Volksbegehren mit 70,4 Prozent der Stimmen angenommen. Schwende-Rüti hat damit anders abgestimmt als der Kanton Appenzell Innerrhoden, der die Vorlage abgelehnt hat."
