"ID","Gemeinde_color","Ja_Stimmen_In_Prozent","Nein_Stimmen_In_Prozent","Gemeinde_de","Text_de"
3101,97.8,97.8,2.2,"Appenzell AI","Ja zur Initiative für eine 13. AHV-Rente in Appenzell: Mit 97,8 Prozent haben die Stimmbürgerinnen und Stimmbürger das Volksbegehren angenommen. Appenzell hat damit bei dieser Vorlage den höchsten Ja-Anteil im Kanton Appenzell Innerrhoden."
3102,50,50,50,"Gonten AI","50 Prozent der Abstimmenden in der Gemeinde Gonten haben Ja gesagt zur Initiative für eine 13. AHV-Rente. Gonten hat damit anders abgestimmt als der Kanton Appenzell Innerrhoden, der die Vorlage abgelehnt hat."
3104,17.7,17.7,82.3,"Schlatt-Haslen AI","In Schlatt-Haslen hat die Stimmbevölkerung die Initiative für eine 13. AHV-Rente abgelehnt. Das Volksbegehren wurde mit einem Nein-Stimmen-Anteil von 82,3 Prozent verworfen. Schlatt-Haslen hat damit bei dieser Vorlage den höchsten Nein-Anteil im Kanton Appenzell Innerrhoden."
3111,32.9,32.9,67.1,"Oberegg AI","In Oberegg hat die Stimmbevölkerung die Initiative für eine 13. AHV-Rente abgelehnt. Das Volksbegehren wurde mit einem Nein-Stimmen-Anteil von 67,1 Prozent verworfen. Oberegg hat damit gleich wie der Kanton Appenzell Innerrhoden Nein gesagt zu dieser Vorlage."
3112,45.9,45.9,54.1,"Schwende-Rüti AI","Schwende-Rüti hat die Initiative für eine 13. AHV-Rente mit 54,1 Prozent abgelehnt. Schwende-Rüti hat damit gleich wie der Kanton Appenzell Innerrhoden Nein gesagt zu dieser Vorlage."
