"Gemeinde_Nr","Gemeinde_color","Ja_Stimmen_In_Prozent","Nein_Stimmen_In_Prozent","Gemeinde_de","Text_de"
3101,45.8,45.8,54.2,"Appenzell AI","54,2 Prozent der Stimmbürgerinnen und Stimmbürger von Appenzell sagen Nein zur Initiative für eine 13. AHV-Rente. Appenzell hat damit bei dieser Vorlage den höchsten Nein-Anteil im Kanton Appenzell Innerrhoden."
3102,60.5,60.5,39.5,"Gonten AI","60,5 Prozent der Abstimmenden in der Gemeinde Gonten haben Ja gesagt zur Initiative für eine 13. AHV-Rente. Gonten hat damit gleich wie der Kanton Appenzell Innerrhoden Ja gesagt zu dieser Vorlage."
3104,94.7,94.7,5.3,"Schlatt-Haslen AI","In Schlatt-Haslen hat die Stimmbevölkerung der Initiative für eine 13. AHV-Rente zugestimmt. Sie wurde mit einem Ja-Stimmen-Anteil von 94,7 Prozent angenommen. Schlatt-Haslen hat damit bei dieser Vorlage den höchsten Ja-Anteil im Kanton Appenzell Innerrhoden."
3111,81.4,81.4,18.6,"Oberegg AI","In Oberegg hat die Stimmbevölkerung der Initiative für eine 13. AHV-Rente zugestimmt. Sie wurde mit einem Ja-Stimmen-Anteil von 81,4 Prozent angenommen. Oberegg hat damit gleich wie der Kanton Appenzell Innerrhoden Ja gesagt zu dieser Vorlage."
3112,63.2,63.2,36.8,"Schwende-Rüti AI","Ja zur Initiative für eine 13. AHV-Rente in Schwende-Rüti. Die Gemeinde hat das Volksbegehren mit 63,2 Prozent der Stimmen angenommen. Schwende-Rüti hat damit gleich wie der Kanton Appenzell Innerrhoden Ja gesagt zu dieser Vorlage."
