"ID","Gemeinde_color","Ja_Stimmen_In_Prozent","Nein_Stimmen_In_Prozent","Gemeinde_de","Text_de"
3101,56.8,56.8,43.2,"Appenzell AI","Ja zur Renteninitiative in Appenzell: Mit 56,8 Prozent haben die Stimmbürgerinnen und Stimmbürger das Volksbegehren angenommen."
3102,70.1,70.1,29.9,"Gonten AI","70,1 Prozent der Abstimmenden in der Gemeinde Gonten haben Ja gesagt zur Renteninitiative. Gonten hat damit gleich wie der Kanton Appenzell Innerrhoden Ja gesagt zu dieser Vorlage."
3104,76.5,76.5,23.5,"Schlatt-Haslen AI","In Schlatt-Haslen hat die Stimmbevölkerung der Renteninitiative zugestimmt. Sie wurde mit einem Ja-Stimmen-Anteil von 76,5 Prozent angenommen. Schlatt-Haslen hat damit bei dieser Vorlage den höchsten Ja-Anteil im Kanton Appenzell Innerrhoden."
3111,57.8,57.8,42.2,"Oberegg AI","In Oberegg hat die Stimmbevölkerung der Renteninitiative zugestimmt. Sie wurde mit einem Ja-Stimmen-Anteil von 57,8 Prozent angenommen. Oberegg hat damit gleich wie der Kanton Appenzell Innerrhoden Ja gesagt zu dieser Vorlage."
3112,67.3,67.3,32.7,"Schwende-Rüti AI","Ja zur Renteninitiative in Schwende-Rüti. Die Gemeinde hat das Volksbegehren mit 67,3 Prozent der Stimmen angenommen. Schwende-Rüti hat damit gleich wie der Kanton Appenzell Innerrhoden Ja gesagt zu dieser Vorlage."
