"ID","Gemeinde_color","Ja_Stimmen_In_Prozent","Nein_Stimmen_In_Prozent","Gemeinde_de","Text_de"
3101,69.3,69.3,30.7,"Appenzell AI","Ja zur Renteninitiative in Appenzell: Mit 69,3 Prozent haben die Stimmbürgerinnen und Stimmbürger das Volksbegehren angenommen. Appenzell hat damit bei dieser Vorlage den höchsten Ja-Anteil im Kanton Appenzell Innerrhoden."
3102,46,46,54,"Gonten AI","Keine Mehrheit für die Renteninitiative in Gonten: Mit 8'285 Nein-Stimmen zu 7'071 Ja-Stimmen oder 54 Prozent hat die Gemeinde das Volksbegehren verworfen. Gonten hat damit anders abgestimmt als der Kanton Appenzell Innerrhoden, der die Vorlage angenommen hat."
3104,3.8,3.8,96.2,"Schlatt-Haslen AI","In Schlatt-Haslen hat die Stimmbevölkerung die Renteninitiative abgelehnt. Das Volksbegehren wurde mit einem Nein-Stimmen-Anteil von 96,2 Prozent verworfen. Schlatt-Haslen hat damit bei dieser Vorlage den höchsten Nein-Anteil im Kanton Appenzell Innerrhoden."
3111,36.3,36.3,63.7,"Oberegg AI","In Oberegg hat die Stimmbevölkerung die Renteninitiative abgelehnt. Das Volksbegehren wurde mit einem Nein-Stimmen-Anteil von 63,7 Prozent verworfen. Oberegg hat damit anders abgestimmt als der Kanton Appenzell Innerrhoden, der die Vorlage angenommen hat."
3112,17.6,17.6,82.4,"Schwende-Rüti AI","Schwende-Rüti hat die Renteninitiative mit 82,4 Prozent abgelehnt. Schwende-Rüti hat damit anders abgestimmt als der Kanton Appenzell Innerrhoden, der die Vorlage angenommen hat."
