"ID","Gemeinde_color","Ja_Stimmen_In_Prozent","Nein_Stimmen_In_Prozent","Gemeinde_de","Text_de"
3101,50.5,50.5,49.5,"Appenzell AI","Ja zur Initiative für eine 13. AHV-Rente in Appenzell: Mit 50,5 Prozent haben die Stimmbürgerinnen und Stimmbürger das Volksbegehren angenommen. Appenzell hat damit anders abgestimmt als der Kanton Appenzell Innerrhoden, der die Vorlage abgelehnt hat."
3102,82.2,82.2,17.8,"Gonten AI","82,2 Prozent der Abstimmenden in der Gemeinde Gonten haben Ja gesagt zur Initiative für eine 13. AHV-Rente. Gonten hat damit bei dieser Vorlage den höchsten Ja-Anteil im Kanton Appenzell Innerrhoden."
3104,44,44,56,"Schlatt-Haslen AI","In Schlatt-Haslen hat die Stimmbevölkerung die Initiative für eine 13. AHV-Rente abgelehnt. Das Volksbegehren wurde mit einem Nein-Stimmen-Anteil von 56 Prozent verworfen. Schlatt-Haslen hat damit gleich wie der Kanton Appenzell Innerrhoden Nein gesagt zu dieser Vorlage."
3111,51.6,51.6,48.4,"Oberegg AI","In Oberegg hat die Stimmbevölkerung der Initiative für eine 13. AHV-Rente zugestimmt. Sie wurde mit einem Ja-Stimmen-Anteil von 51,6 Prozent angenommen. Oberegg hat damit anders abgestimmt als der Kanton Appenzell Innerrhoden, der die Vorlage abgelehnt hat."
3112,30.4,30.4,69.6,"Schwende-Rüti AI","Schwende-Rüti hat die Initiative für eine 13. AHV-Rente mit 69,6 Prozent abgelehnt. Schwende-Rüti hat damit bei dieser Vorlage den höchsten Nein-Anteil im Kanton Appenzell Innerrhoden."
