"ID","Gemeinde_color","Ja_Stimmen_In_Prozent","Nein_Stimmen_In_Prozent","Gemeinde_de","Text_de"
1401,67.1,67.1,32.9,"Alpnach OW","Ja zur Renteninitiative in Alpnach. Die Gemeinde hat das Volksbegehren mit 67,1 Prozent der Stimmen angenommen. Alpnach hat damit anders abgestimmt als der Kanton Obwalden, der die Vorlage abgelehnt hat."
1402,87.7,87.7,12.3,"Engelberg OW","In Engelberg hat die Stimmbevölkerung der Renteninitiative zugestimmt. Sie wurde mit einem Ja-Stimmen-Anteil von 87,7 Prozent angenommen. Engelberg hat damit anders abgestimmt als der Kanton Obwalden, der die Vorlage abgelehnt hat."
1403,58.2,58.2,41.8,"Giswil OW","In Giswil hat die Stimmbevölkerung der Renteninitiative zugestimmt. Sie wurde mit einem Ja-Stimmen-Anteil von 58,2 Prozent angenommen. Giswil hat damit anders abgestimmt als der Kanton Obwalden, der die Vorlage abgelehnt hat."
1404,88.5,88.5,11.5,"Kerns OW","88,5 Prozent der Abstimmenden in der Gemeinde Kerns haben Ja gesagt zur Renteninitiative. Kerns hat damit bei dieser Vorlage den höchsten Ja-Anteil im Kanton Obwalden."
1405,51.2,51.2,48.8,"Lungern OW","51,2 Prozent der Abstimmenden in der Gemeinde Lungern haben Ja gesagt zur Renteninitiative. Lungern hat damit anders abgestimmt als der Kanton Obwalden, der die Vorlage abgelehnt hat."
1406,56.5,56.5,43.5,"Sachseln OW","Ja zur Renteninitiative in Sachseln. Die Gemeinde hat das Volksbegehren mit 56,5 Prozent der Stimmen angenommen. Sachseln hat damit anders abgestimmt als der Kanton Obwalden, der die Vorlage abgelehnt hat."
1407,19.5,19.5,80.5,"Sarnen OW","In Sarnen hat die Renteninitiative keine Mehrheit gefunden. Auf 80,5 Prozent der abgegebenen Stimmzettel stand ein Nein. Sarnen hat damit bei dieser Vorlage den höchsten Nein-Anteil im Kanton Obwalden."
