"ID","Gemeinde_color","Ja_Stimmen_In_Prozent","Nein_Stimmen_In_Prozent","Gemeinde_de","Text_de"
1401,82.8,82.8,17.2,"Alpnach OW","Ja zur Renteninitiative in Alpnach. Die Gemeinde hat das Volksbegehren mit 82,8 Prozent der Stimmen angenommen. Alpnach hat damit bei dieser Vorlage den höchsten Ja-Anteil im Kanton Obwalden."
1402,65.9,65.9,34.1,"Engelberg OW","In Engelberg hat die Stimmbevölkerung der Renteninitiative zugestimmt. Sie wurde mit einem Ja-Stimmen-Anteil von 65,9 Prozent angenommen. Engelberg hat damit anders abgestimmt als der Kanton Obwalden, der die Vorlage abgelehnt hat."
1403,42.3,42.3,57.7,"Giswil OW","In Giswil hat die Stimmbevölkerung die Renteninitiative abgelehnt. Das Volksbegehren wurde mit einem Nein-Stimmen-Anteil von 57,7 Prozent verworfen. Giswil hat damit gleich wie der Kanton Obwalden Nein gesagt zu dieser Vorlage."
1404,19.8,19.8,80.2,"Kerns OW","Keine Mehrheit für die Renteninitiative in Kerns: Mit 8'959 Nein-Stimmen zu 2'214 Ja-Stimmen oder 80,2 Prozent hat die Gemeinde das Volksbegehren verworfen. Kerns hat damit bei dieser Vorlage den höchsten Nein-Anteil im Kanton Obwalden."
1405,46.9,46.9,53.1,"Lungern OW","Keine Mehrheit für die Renteninitiative in Lungern: Mit 9'601 Nein-Stimmen zu 8'477 Ja-Stimmen oder 53,1 Prozent hat die Gemeinde das Volksbegehren verworfen. Lungern hat damit gleich wie der Kanton Obwalden Nein gesagt zu dieser Vorlage."
1406,49,49,51,"Sachseln OW","Sachseln hat die Renteninitiative mit 51 Prozent abgelehnt. Sachseln hat damit gleich wie der Kanton Obwalden Nein gesagt zu dieser Vorlage."
1407,64.4,64.4,35.6,"Sarnen OW","Die Gemeinde Sarnen hat die Renteninitiative mit 64,4 Prozent Ja-Stimmen angenommen. Sarnen hat damit anders abgestimmt als der Kanton Obwalden, der die Vorlage abgelehnt hat."
