"Gemeinde_Nr","Gemeinde_color","Ja_Stimmen_In_Prozent","Nein_Stimmen_In_Prozent","Gemeinde_de","Text_de"
1401,42.1,42.1,57.9,"Alpnach OW","Alpnach hat die Renteninitiative mit 57,9 Prozent abgelehnt. Alpnach hat damit anders abgestimmt als der Kanton Obwalden, der die Vorlage angenommen hat."
1402,13.5,13.5,86.5,"Engelberg OW","In Engelberg hat die Stimmbevölkerung die Renteninitiative abgelehnt. Das Volksbegehren wurde mit einem Nein-Stimmen-Anteil von 86,5 Prozent verworfen. Engelberg hat damit bei dieser Vorlage den höchsten Nein-Anteil im Kanton Obwalden."
1403,65.8,65.8,34.2,"Giswil OW","In Giswil hat die Stimmbevölkerung der Renteninitiative zugestimmt. Sie wurde mit einem Ja-Stimmen-Anteil von 65,8 Prozent angenommen. Giswil hat damit gleich wie der Kanton Obwalden Ja gesagt zu dieser Vorlage."
1404,51.3,51.3,48.7,"Kerns OW","51,3 Prozent der Abstimmenden in der Gemeinde Kerns haben Ja gesagt zur Renteninitiative. Kerns hat damit gleich wie der Kanton Obwalden Ja gesagt zu dieser Vorlage."
1405,74.3,74.3,25.7,"Lungern OW","74,3 Prozent der Abstimmenden in der Gemeinde Lungern haben Ja gesagt zur Renteninitiative. Lungern hat damit gleich wie der Kanton Obwalden Ja gesagt zu dieser Vorlage."
1406,17.4,17.4,82.6,"Sachseln OW","Sachseln hat die Renteninitiative mit 82,6 Prozent abgelehnt. Sachseln hat damit anders abgestimmt als der Kanton Obwalden, der die Vorlage angenommen hat."
1407,74.3,74.3,25.7,"Sarnen OW","Die Gemeinde Sarnen hat die Renteninitiative mit 74,3 Prozent Ja-Stimmen angenommen. Sarnen hat damit bei dieser Vorlage den höchsten Ja-Anteil im Kanton Obwalden."
