"ID","Gemeinde_color","Ja_Stimmen_In_Prozent","Nein_Stimmen_In_Prozent","Gemeinde_de","Text_de"
1401,15.3,15.3,84.7,"Alpnach OW","Alpnach hat die Initiative für eine 13. AHV-Rente mit 84,7 Prozent abgelehnt. Alpnach hat damit bei dieser Vorlage den höchsten Nein-Anteil im Kanton Obwalden."
1402,47.1,47.1,52.9,"Engelberg OW","In Engelberg hat die Stimmbevölkerung die Initiative für eine 13. AHV-Rente abgelehnt. Das Volksbegehren wurde mit einem Nein-Stimmen-Anteil von 52,9 Prozent verworfen. Engelberg hat damit gleich wie der Kanton Obwalden Nein gesagt zu dieser Vorlage."
1403,50.7,50.7,49.3,"Giswil OW","In Giswil hat die Stimmbevölkerung der Initiative für eine 13. AHV-Rente zugestimmt. Sie wurde mit einem Ja-Stimmen-Anteil von 50,7 Prozent angenommen. Giswil hat damit anders abgestimmt als der Kanton Obwalden, der die Vorlage abgelehnt hat."
1404,63.9,63.9,36.1,"Kerns OW","63,9 Prozent der Abstimmenden in der Gemeinde Kerns haben Ja gesagt zur Initiative für eine 13. AHV-Rente. Kerns hat damit anders abgestimmt als der Kanton Obwalden, der die Vorlage abgelehnt hat."
1405,53.4,53.4,46.6,"Lungern OW","53,4 Prozent der Abstimmenden in der Gemeinde Lungern haben Ja gesagt zur Initiative für eine 13. AHV-Rente. Lungern hat damit anders abgestimmt als der Kanton Obwalden, der die Vorlage abgelehnt hat."
1406,66.6,66.6,33.4,"Sachseln OW","Ja zur Initiative für eine 13. AHV-Rente in Sachseln. Die Gemeinde hat das Volksbegehren mit 66,6 Prozent der Stimmen angenommen. Sachseln hat damit anders abgestimmt als der Kanton Obwalden, der die Vorlage abgelehnt hat."
1407,79.2,79.2,20.8,"Sarnen OW","Die Gemeinde Sarnen hat die Initiative für eine 13. AHV-Rente mit 79,2 Prozent Ja-Stimmen angenommen. Sarnen hat damit bei dieser Vorlage den höchsten Ja-Anteil im Kanton Obwalden."
