"ID","Gemeinde_color","Ja_Stimmen_In_Prozent","Nein_Stimmen_In_Prozent","Gemeinde_de","Text_de"
1401,8.9,8.9,91.1,"Alpnach OW","Alpnach hat die Initiative für eine 13. AHV-Rente mit 91,1 Prozent abgelehnt. Alpnach hat damit bei dieser Vorlage den höchsten Nein-Anteil im Kanton Obwalden."
1402,45.9,45.9,54.1,"Engelberg OW","In Engelberg hat die Stimmbevölkerung die Initiative für eine 13. AHV-Rente abgelehnt. Das Volksbegehren wurde mit einem Nein-Stimmen-Anteil von 54,1 Prozent verworfen. Engelberg hat damit anders abgestimmt als der Kanton Obwalden, der die Vorlage angenommen hat."
1403,80.4,80.4,19.6,"Giswil OW","In Giswil hat die Stimmbevölkerung der Initiative für eine 13. AHV-Rente zugestimmt. Sie wurde mit einem Ja-Stimmen-Anteil von 80,4 Prozent angenommen. Giswil hat damit bei dieser Vorlage den höchsten Ja-Anteil im Kanton Obwalden."
1404,24.3,24.3,75.7,"Kerns OW","Keine Mehrheit für die Initiative für eine 13. AHV-Rente in Kerns: Mit 6'170 Nein-Stimmen zu 1'980 Ja-Stimmen oder 75,7 Prozent hat die Gemeinde das Volksbegehren verworfen. Kerns hat damit anders abgestimmt als der Kanton Obwalden, der die Vorlage angenommen hat."
1405,74.2,74.2,25.8,"Lungern OW","74,2 Prozent der Abstimmenden in der Gemeinde Lungern haben Ja gesagt zur Initiative für eine 13. AHV-Rente. Lungern hat damit gleich wie der Kanton Obwalden Ja gesagt zu dieser Vorlage."
1406,71.2,71.2,28.8,"Sachseln OW","Ja zur Initiative für eine 13. AHV-Rente in Sachseln. Die Gemeinde hat das Volksbegehren mit 71,2 Prozent der Stimmen angenommen. Sachseln hat damit gleich wie der Kanton Obwalden Ja gesagt zu dieser Vorlage."
1407,12.4,12.4,87.6,"Sarnen OW","In Sarnen hat die Initiative für eine 13. AHV-Rente keine Mehrheit gefunden. Auf 87,6 Prozent der abgegebenen Stimmzettel stand ein Nein. Sarnen hat damit anders abgestimmt als der Kanton Obwalden, der die Vorlage angenommen hat."
