"ID","Gemeinde_color","Ja_Stimmen_In_Prozent","Nein_Stimmen_In_Prozent","Gemeinde_de","Text_de"
1401,84.4,84.4,15.6,"Alpnach OW","Ja zur Renteninitiative in Alpnach. Die Gemeinde hat das Volksbegehren mit 84,4 Prozent der Stimmen angenommen. Alpnach hat damit bei dieser Vorlage den höchsten Ja-Anteil im Kanton Obwalden."
1402,57.1,57.1,42.9,"Engelberg OW","In Engelberg hat die Stimmbevölkerung der Renteninitiative zugestimmt. Sie wurde mit einem Ja-Stimmen-Anteil von 57,1 Prozent angenommen. Engelberg hat damit anders abgestimmt als der Kanton Obwalden, der die Vorlage abgelehnt hat."
1403,13.8,13.8,86.2,"Giswil OW","In Giswil hat die Stimmbevölkerung die Renteninitiative abgelehnt. Das Volksbegehren wurde mit einem Nein-Stimmen-Anteil von 86,2 Prozent verworfen. Giswil hat damit bei dieser Vorlage den höchsten Nein-Anteil im Kanton Obwalden."
1404,30.6,30.6,69.4,"Kerns OW","Keine Mehrheit für die Renteninitiative in Kerns: Mit 8'894 Nein-Stimmen zu 3'922 Ja-Stimmen oder 69,4 Prozent hat die Gemeinde das Volksbegehren verworfen. Kerns hat damit gleich wie der Kanton Obwalden Nein gesagt zu dieser Vorlage."
1405,83.5,83.5,16.5,"Lungern OW","83,5 Prozent der Abstimmenden in der Gemeinde Lungern haben Ja gesagt zur Renteninitiative. Lungern hat damit anders abgestimmt als der Kanton Obwalden, der die Vorlage abgelehnt hat."
1406,79.2,79.2,20.8,"Sachseln OW","Ja zur Renteninitiative in Sachseln. Die Gemeinde hat das Volksbegehren mit 79,2 Prozent der Stimmen angenommen. Sachseln hat damit anders abgestimmt als der Kanton Obwalden, der die Vorlage abgelehnt hat."
1407,51.2,51.2,48.8,"Sarnen OW","Die Gemeinde Sarnen hat die Renteninitiative mit 51,2 Prozent Ja-Stimmen angenommen. Sarnen hat damit anders abgestimmt als der Kanton Obwalden, der die Vorlage abgelehnt hat."
