"ID","Gemeinde_color","Ja_Stimmen_In_Prozent","Nein_Stimmen_In_Prozent","Gemeinde_de","Text_de"
1401,2.7,2.7,97.3,"Alpnach OW","Alpnach hat die Initiative für eine 13. AHV-Rente mit 97,3 Prozent abgelehnt. Alpnach hat damit bei dieser Vorlage den höchsten Nein-Anteil im Kanton Obwalden."
1402,51.6,51.6,48.4,"Engelberg OW","In Engelberg hat die Stimmbevölkerung der Initiative für eine 13. AHV-Rente zugestimmt. Sie wurde mit einem Ja-Stimmen-Anteil von 51,6 Prozent angenommen. Engelberg hat damit gleich wie der Kanton Obwalden Ja gesagt zu dieser Vorlage."
1403,72.6,72.6,27.4,"Giswil OW","In Giswil hat die Stimmbevölkerung der Initiative für eine 13. AHV-Rente zugestimmt. Sie wurde mit einem Ja-Stimmen-Anteil von 72,6 Prozent angenommen. Giswil hat damit gleich wie der Kanton Obwalden Ja gesagt zu dieser Vorlage."
1404,45,45,55,"Kerns OW","Keine Mehrheit für die Initiative für eine 13. AHV-Rente in Kerns: Mit 2'566 Nein-Stimmen zu 2'098 Ja-Stimmen oder 55 Prozent hat die Gemeinde das Volksbegehren verworfen. Kerns hat damit anders abgestimmt als der Kanton Obwalden, der die Vorlage angenommen hat."
1405,37.4,37.4,62.6,"Lungern OW","Keine Mehrheit für die Initiative für eine 13. AHV-Rente in Lungern: Mit 8'298 Nein-Stimmen zu 4'962 Ja-Stimmen oder 62,6 Prozent hat die Gemeinde das Volksbegehren verworfen. Lungern hat damit anders abgestimmt als der Kanton Obwalden, der die Vorlage angenommen hat."
1406,72.7,72.7,27.3,"Sachseln OW","Ja zur Initiative für eine 13. AHV-Rente in Sachseln. Die Gemeinde hat das Volksbegehren mit 72,7 Prozent der Stimmen angenommen. Sachseln hat damit bei dieser Vorlage den höchsten Ja-Anteil im Kanton Obwalden."
1407,25.6,25.6,74.4,"Sarnen OW","In Sarnen hat die Initiative für eine 13. AHV-Rente keine Mehrheit gefunden. Auf 74,4 Prozent der abgegebenen Stimmzettel stand ein Nein. Sarnen hat damit anders abgestimmt als der Kanton Obwalden, der die Vorlage angenommen hat."
