"ID","Gemeinde_color","Ja_Stimmen_In_Prozent","Nein_Stimmen_In_Prozent","Gemeinde_de","Text_de"
1401,97.8,97.8,2.2,"Alpnach OW","Ja zur Initiative für eine 13. AHV-Rente in Alpnach. Die Gemeinde hat das Volksbegehren mit 97,8 Prozent der Stimmen angenommen. Alpnach hat damit bei dieser Vorlage den höchsten Ja-Anteil im Kanton Obwalden."
1402,32.5,32.5,67.5,"Engelberg OW","In Engelberg hat die Stimmbevölkerung die Initiative für eine 13. AHV-Rente abgelehnt. Das Volksbegehren wurde mit einem Nein-Stimmen-Anteil von 67,5 Prozent verworfen. Engelberg hat damit gleich wie der Kanton Obwalden Nein gesagt zu dieser Vorlage."
1403,51.7,51.7,48.3,"Giswil OW","In Giswil hat die Stimmbevölkerung der Initiative für eine 13. AHV-Rente zugestimmt. Sie wurde mit einem Ja-Stimmen-Anteil von 51,7 Prozent angenommen. Giswil hat damit anders abgestimmt als der Kanton Obwalden, der die Vorlage abgelehnt hat."
1404,1,1,99,"Kerns OW","Keine Mehrheit für die Initiative für eine 13. AHV-Rente in Kerns: Mit 8'109 Nein-Stimmen zu 86 Ja-Stimmen oder 99 Prozent hat die Gemeinde das Volksbegehren verworfen. Kerns hat damit bei dieser Vorlage den höchsten Nein-Anteil im Kanton Obwalden."
1405,44.9,44.9,55.1,"Lungern OW","Keine Mehrheit für die Initiative für eine 13. AHV-Rente in Lungern: Mit 5'189 Nein-Stimmen zu 4'231 Ja-Stimmen oder 55,1 Prozent hat die Gemeinde das Volksbegehren verworfen. Lungern hat damit gleich wie der Kanton Obwalden Nein gesagt zu dieser Vorlage."
1406,40.6,40.6,59.4,"Sachseln OW","Sachseln hat die Initiative für eine 13. AHV-Rente mit 59,4 Prozent abgelehnt. Sachseln hat damit gleich wie der Kanton Obwalden Nein gesagt zu dieser Vorlage."
1407,78.6,78.6,21.4,"Sarnen OW","Die Gemeinde Sarnen hat die Initiative für eine 13. AHV-Rente mit 78,6 Prozent Ja-Stimmen angenommen. Sarnen hat damit anders abgestimmt als der Kanton Obwalden, der die Vorlage abgelehnt hat."
