"ID","Gemeinde_color","Ja_Stimmen_In_Prozent","Nein_Stimmen_In_Prozent","Gemeinde_de","Text_de"
1401,13.5,13.5,86.5,"Alpnach OW","Alpnach hat die Initiative für eine 13. AHV-Rente mit 86,5 Prozent abgelehnt. Alpnach hat damit anders abgestimmt als der Kanton Obwalden, der die Vorlage angenommen hat."
1402,59.8,59.8,40.2,"Engelberg OW","In Engelberg hat die Stimmbevölkerung der Initiative für eine 13. AHV-Rente zugestimmt. Sie wurde mit einem Ja-Stimmen-Anteil von 59,8 Prozent angenommen. Engelberg hat damit gleich wie der Kanton Obwalden Ja gesagt zu dieser Vorlage."
1403,9.9,9.9,90.1,"Giswil OW","In Giswil hat die Stimmbevölkerung die Initiative für eine 13. AHV-Rente abgelehnt. Das Volksbegehren wurde mit einem Nein-Stimmen-Anteil von 90,1 Prozent verworfen. Giswil hat damit bei dieser Vorlage den höchsten Nein-Anteil im Kanton Obwalden."
1404,20.4,20.4,79.6,"Kerns OW","Keine Mehrheit für die Initiative für eine 13. AHV-Rente in Kerns: Mit 8'812 Nein-Stimmen zu 2'262 Ja-Stimmen oder 79,6 Prozent hat die Gemeinde das Volksbegehren verworfen. Kerns hat damit anders abgestimmt als der Kanton Obwalden, der die Vorlage angenommen hat."
1405,43.6,43.6,56.4,"Lungern OW","Keine Mehrheit für die Initiative für eine 13. AHV-Rente in Lungern: Mit 9'074 Nein-Stimmen zu 7'027 Ja-Stimmen oder 56,4 Prozent hat die Gemeinde das Volksbegehren verworfen. Lungern hat damit anders abgestimmt als der Kanton Obwalden, der die Vorlage angenommen hat."
1406,22.7,22.7,77.3,"Sachseln OW","Sachseln hat die Initiative für eine 13. AHV-Rente mit 77,3 Prozent abgelehnt. Sachseln hat damit anders abgestimmt als der Kanton Obwalden, der die Vorlage angenommen hat."
1407,89.8,89.8,10.2,"Sarnen OW","Die Gemeinde Sarnen hat die Initiative für eine 13. AHV-Rente mit 89,8 Prozent Ja-Stimmen angenommen. Sarnen hat damit bei dieser Vorlage den höchsten Ja-Anteil im Kanton Obwalden."
