"ID","Gemeinde_color","Ja_Stimmen_In_Prozent","Nein_Stimmen_In_Prozent","Gemeinde_de","Text_de"
2901,10.4,10.4,89.6,"Gächlingen SH","89,6 Prozent der Stimmbürgerinnen und Stimmbürger von Gächlingen sagen Nein zur Renteninitiative. Gächlingen hat damit gleich wie der Kanton Schaffhausen Nein gesagt zu dieser Vorlage."
2903,28.9,28.9,71.1,"Löhningen SH","Löhningen hat die Renteninitiative mit 71,1 Prozent abgelehnt. Löhningen hat damit gleich wie der Kanton Schaffhausen Nein gesagt zu dieser Vorlage."
2904,56,56,44,"Neunkirch SH","Die Gemeinde Neunkirch hat die Renteninitiative mit 56 Prozent Ja-Stimmen angenommen. Neunkirch hat damit anders abgestimmt als der Kanton Schaffhausen, der die Vorlage abgelehnt hat."
2914,74.9,74.9,25.1,"Büttenhardt SH","Die Gemeinde Büttenhardt hat die Renteninitiative mit 74,9 Prozent Ja-Stimmen angenommen. Büttenhardt hat damit anders abgestimmt als der Kanton Schaffhausen, der die Vorlage abgelehnt hat."
2915,28.8,28.8,71.2,"Dörflingen SH","Dörflingen hat die Renteninitiative mit 71,2 Prozent abgelehnt. Dörflingen hat damit gleich wie der Kanton Schaffhausen Nein gesagt zu dieser Vorlage."
2917,15.2,15.2,84.8,"Lohn SH","84,8 Prozent der Stimmbürgerinnen und Stimmbürger von Lohn SH sagen Nein zur Renteninitiative. Lohn SH hat damit gleich wie der Kanton Schaffhausen Nein gesagt zu dieser Vorlage."
2919,92.8,92.8,7.2,"Stetten SH","92,8 Prozent der Abstimmenden in der Gemeinde Stetten SH haben Ja gesagt zur Renteninitiative. Stetten SH hat damit anders abgestimmt als der Kanton Schaffhausen, der die Vorlage abgelehnt hat."
2920,29.7,29.7,70.3,"Thayngen SH","Nein zur Renteninitiative in Thayngen mit 70,3 Prozent Ablehnung. Thayngen hat damit gleich wie der Kanton Schaffhausen Nein gesagt zu dieser Vorlage."
2931,6.1,6.1,93.9,"Bargen SH","Keine Mehrheit für die Renteninitiative in Bargen SH: Mit 5'123 Nein-Stimmen zu 333 Ja-Stimmen oder 93,9 Prozent hat die Gemeinde das Volksbegehren verworfen. Bargen SH hat damit bei dieser Vorlage den höchsten Nein-Anteil im Kanton Schaffhausen."
2932,73.4,73.4,26.6,"Beringen SH","Ja zur Renteninitiative in Beringen: Mit 73,4 Prozent haben die Stimmbürgerinnen und Stimmbürger das Volksbegehren angenommen. Beringen hat damit anders abgestimmt als der Kanton Schaffhausen, der die Vorlage abgelehnt hat."
2933,12.4,12.4,87.6,"Buchberg SH","In Buchberg hat die Stimmbevölkerung die Renteninitiative abgelehnt. Das Volksbegehren wurde mit einem Nein-Stimmen-Anteil von 87,6 Prozent verworfen. Buchberg hat damit gleich wie der Kanton Schaffhausen Nein gesagt zu dieser Vorlage."
2936,47.7,47.7,52.3,"Merishausen SH","Nein zur Renteninitiative in Merishausen: Mit 52,3 Prozent haben die Stimmbürgerinnen und Stimmbürger das Volksbegehren abgelehnt. Merishausen hat damit gleich wie der Kanton Schaffhausen Nein gesagt zu dieser Vorlage."
2937,51,51,49,"Neuhausen am Rheinfall SH","Ja zur Renteninitiative in Neuhausen am Rheinfall: Mit 51 Prozent haben die Stimmbürgerinnen und Stimmbürger das Volksbegehren angenommen. Neuhausen am Rheinfall hat damit anders abgestimmt als der Kanton Schaffhausen, der die Vorlage abgelehnt hat."
2938,41.9,41.9,58.1,"Rüdlingen SH","In Rüdlingen hat die Renteninitiative keine Mehrheit gefunden. Auf 58,1 Prozent der abgegebenen Stimmzettel stand ein Nein. Rüdlingen hat damit gleich wie der Kanton Schaffhausen Nein gesagt zu dieser Vorlage."
2939,79.1,79.1,20.9,"Schaffhausen SH","Die Gemeinde Schaffhausen hat die Renteninitiative mit 79,1 Prozent Ja-Stimmen angenommen. Schaffhausen hat damit anders abgestimmt als der Kanton Schaffhausen, der die Vorlage abgelehnt hat."
2951,40.1,40.1,59.9,"Beggingen SH","Keine Mehrheit für die Renteninitiative in Beggingen: Mit 6'175 Nein-Stimmen zu 4'128 Ja-Stimmen oder 59,9 Prozent hat die Gemeinde das Volksbegehren verworfen. Beggingen hat damit gleich wie der Kanton Schaffhausen Nein gesagt zu dieser Vorlage."
2952,73.3,73.3,26.7,"Schleitheim SH","Ja zur Renteninitiative in Schleitheim. Die Gemeinde hat das Volksbegehren mit 73,3 Prozent der Stimmen angenommen. Schleitheim hat damit anders abgestimmt als der Kanton Schaffhausen, der die Vorlage abgelehnt hat."
2953,7.6,7.6,92.4,"Siblingen SH","In Siblingen hat die Stimmbevölkerung die Renteninitiative abgelehnt. Das Volksbegehren wurde mit einem Nein-Stimmen-Anteil von 92,4 Prozent verworfen. Siblingen hat damit gleich wie der Kanton Schaffhausen Nein gesagt zu dieser Vorlage."
2961,51.1,51.1,48.9,"Buch SH","Die Gemeinde Buch SH hat die Renteninitiative mit 51,1 Prozent angenommen. Buch SH hat damit anders abgestimmt als der Kanton Schaffhausen, der die Vorlage abgelehnt hat."
2962,65.2,65.2,34.8,"Hemishofen SH","65,2 Prozent der Stimmbürgerinnen und Stimmbürger von Hemishofen haben die Renteninitiative angenommen. Hemishofen hat damit anders abgestimmt als der Kanton Schaffhausen, der die Vorlage abgelehnt hat."
2963,77.5,77.5,22.5,"Ramsen SH","In Ramsen hat die Stimmbevölkerung der Renteninitiative zugestimmt. Sie wurde mit einem Ja-Stimmen-Anteil von 77,5 Prozent angenommen. Ramsen hat damit anders abgestimmt als der Kanton Schaffhausen, der die Vorlage abgelehnt hat."
2964,42.5,42.5,57.5,"Stein am Rhein SH","Nein zur Renteninitiative in Stein am Rhein mit 57,5 Prozent Ablehnung. Stein am Rhein hat damit gleich wie der Kanton Schaffhausen Nein gesagt zu dieser Vorlage."
2971,94.8,94.8,5.2,"Hallau SH","94,8 Prozent der Abstimmenden in der Gemeinde Hallau haben Ja gesagt zur Renteninitiative. Hallau hat damit bei dieser Vorlage den höchsten Ja-Anteil im Kanton Schaffhausen."
2972,49.3,49.3,50.7,"Oberhallau SH","50,7 Prozent der Stimmbürgerinnen und Stimmbürger von Oberhallau sagen Nein zur Renteninitiative. Oberhallau hat damit gleich wie der Kanton Schaffhausen Nein gesagt zu dieser Vorlage."
2973,44.9,44.9,55.1,"Trasadingen SH","Keine Mehrheit für die Renteninitiative in Trasadingen: Mit 2'009 Nein-Stimmen zu 1'636 Ja-Stimmen oder 55,1 Prozent hat die Gemeinde das Volksbegehren verworfen. Trasadingen hat damit gleich wie der Kanton Schaffhausen Nein gesagt zu dieser Vorlage."
2974,6.6,6.6,93.4,"Wilchingen SH","Nein zur Renteninitiative in Wilchingen: Mit 93,4 Prozent haben die Stimmbürgerinnen und Stimmbürger das Volksbegehren abgelehnt. Wilchingen hat damit gleich wie der Kanton Schaffhausen Nein gesagt zu dieser Vorlage."
