"ID","Gemeinde_color","Ja_Stimmen_In_Prozent","Nein_Stimmen_In_Prozent","Gemeinde_de","Text_de"
2901,83.4,83.4,16.6,"Gächlingen SH","Ja zur Initiative für eine 13. AHV-Rente in Gächlingen: Mit 83,4 Prozent haben die Stimmbürgerinnen und Stimmbürger das Volksbegehren angenommen. Gächlingen hat damit anders abgestimmt als der Kanton Schaffhausen, der die Vorlage abgelehnt hat."
2903,69.8,69.8,30.2,"Löhningen SH","Ja zur Initiative für eine 13. AHV-Rente in Löhningen. Die Gemeinde hat das Volksbegehren mit 69,8 Prozent der Stimmen angenommen. Löhningen hat damit anders abgestimmt als der Kanton Schaffhausen, der die Vorlage abgelehnt hat."
2904,97.1,97.1,2.9,"Neunkirch SH","Die Gemeinde Neunkirch hat die Initiative für eine 13. AHV-Rente mit 97,1 Prozent Ja-Stimmen angenommen. Neunkirch hat damit bei dieser Vorlage den höchsten Ja-Anteil im Kanton Schaffhausen."
2914,21.7,21.7,78.3,"Büttenhardt SH","In Büttenhardt hat die Initiative für eine 13. AHV-Rente keine Mehrheit gefunden. Auf 78,3 Prozent der abgegebenen Stimmzettel stand ein Nein. Büttenhardt hat damit gleich wie der Kanton Schaffhausen Nein gesagt zu dieser Vorlage."
2915,48,48,52,"Dörflingen SH","Dörflingen hat die Initiative für eine 13. AHV-Rente mit 52 Prozent abgelehnt. Dörflingen hat damit gleich wie der Kanton Schaffhausen Nein gesagt zu dieser Vorlage."
2917,95.6,95.6,4.4,"Lohn SH","Ja zur Initiative für eine 13. AHV-Rente in Lohn SH: Mit 95,6 Prozent haben die Stimmbürgerinnen und Stimmbürger das Volksbegehren angenommen. Lohn SH hat damit anders abgestimmt als der Kanton Schaffhausen, der die Vorlage abgelehnt hat."
2919,23.4,23.4,76.6,"Stetten SH","Keine Mehrheit für die Initiative für eine 13. AHV-Rente in Stetten SH: Mit 2'040 Nein-Stimmen zu 622 Ja-Stimmen oder 76,6 Prozent hat die Gemeinde das Volksbegehren verworfen. Stetten SH hat damit gleich wie der Kanton Schaffhausen Nein gesagt zu dieser Vorlage."
2920,26,26,74,"Thayngen SH","Nein zu einer 13. AHV-Rente in Thayngen. Die Gemeinde hat die Initiative mit 74 Prozent abgelehnt. Thayngen hat damit gleich wie der Kanton Schaffhausen Nein gesagt zu dieser Vorlage."
2931,68.4,68.4,31.6,"Bargen SH","68,4 Prozent der Abstimmenden in der Gemeinde Bargen SH haben Ja gesagt zur Initiative für eine 13. AHV-Rente. Bargen SH hat damit anders abgestimmt als der Kanton Schaffhausen, der die Vorlage abgelehnt hat."
2932,29.1,29.1,70.9,"Beringen SH","70,9 Prozent der Stimmbürgerinnen und Stimmbürger von Beringen sagen Nein zur Initiative für eine 13. AHV-Rente. Beringen hat damit gleich wie der Kanton Schaffhausen Nein gesagt zu dieser Vorlage."
2933,67.9,67.9,32.1,"Buchberg SH","In Buchberg hat die Stimmbevölkerung der Initiative für eine 13. AHV-Rente zugestimmt. Sie wurde mit einem Ja-Stimmen-Anteil von 67,9 Prozent angenommen. Buchberg hat damit anders abgestimmt als der Kanton Schaffhausen, der die Vorlage abgelehnt hat."
2936,62.7,62.7,37.3,"Merishausen SH","62,7 Prozent der Stimmbürgerinnen und Stimmbürger von Merishausen haben die Initiative für eine 13. AHV-Rente angenommen. Merishausen hat damit anders abgestimmt als der Kanton Schaffhausen, der die Vorlage abgelehnt hat."
2937,29.3,29.3,70.7,"Neuhausen am Rheinfall SH","70,7 Prozent der Stimmbürgerinnen und Stimmbürger von Neuhausen am Rheinfall sagen Nein zur Initiative für eine 13. AHV-Rente. Neuhausen am Rheinfall hat damit gleich wie der Kanton Schaffhausen Nein gesagt zu dieser Vorlage."
2938,51.8,51.8,48.2,"Rüdlingen SH","Die Gemeinde Rüdlingen hat die Initiative für eine 13. AHV-Rente mit 51,8 Prozent Ja-Stimmen angenommen. Rüdlingen hat damit anders abgestimmt als der Kanton Schaffhausen, der die Vorlage abgelehnt hat."
2939,11.3,11.3,88.7,"Schaffhausen SH","In Schaffhausen hat die Initiative für eine 13. AHV-Rente keine Mehrheit gefunden. Auf 88,7 Prozent der abgegebenen Stimmzettel stand ein Nein. Schaffhausen hat damit bei dieser Vorlage den höchsten Nein-Anteil im Kanton Schaffhausen."
2951,47.7,47.7,52.3,"Beggingen SH","Keine Mehrheit für die Initiative für eine 13. AHV-Rente in Beggingen: Mit 4'618 Nein-Stimmen zu 4'212 Ja-Stimmen oder 52,3 Prozent hat die Gemeinde das Volksbegehren verworfen. Beggingen hat damit gleich wie der Kanton Schaffhausen Nein gesagt zu dieser Vorlage."
2952,54.1,54.1,45.9,"Schleitheim SH","Ja zur Initiative für eine 13. AHV-Rente in Schleitheim. Die Gemeinde hat das Volksbegehren mit 54,1 Prozent der Stimmen angenommen. Schleitheim hat damit anders abgestimmt als der Kanton Schaffhausen, der die Vorlage abgelehnt hat."
2953,36.6,36.6,63.4,"Siblingen SH","In Siblingen hat die Stimmbevölkerung die Initiative für eine 13. AHV-Rente abgelehnt. Das Volksbegehren wurde mit einem Nein-Stimmen-Anteil von 63,4 Prozent verworfen. Siblingen hat damit gleich wie der Kanton Schaffhausen Nein gesagt zu dieser Vorlage."
2961,59.7,59.7,40.3,"Buch SH","Die Stimmbevölkerung von Buch SH hat die Initiative für eine 13. AHV-Rente mit 59,7 Prozent angenommen. Buch SH hat damit anders abgestimmt als der Kanton Schaffhausen, der die Vorlage abgelehnt hat."
2962,88.8,88.8,11.2,"Hemishofen SH","88,8 Prozent der Stimmbürgerinnen und Stimmbürger von Hemishofen haben die Initiative für eine 13. AHV-Rente angenommen. Hemishofen hat damit anders abgestimmt als der Kanton Schaffhausen, der die Vorlage abgelehnt hat."
2963,13.2,13.2,86.8,"Ramsen SH","In Ramsen hat die Stimmbevölkerung die Initiative für eine 13. AHV-Rente abgelehnt. Das Volksbegehren wurde mit einem Nein-Stimmen-Anteil von 86,8 Prozent verworfen. Ramsen hat damit gleich wie der Kanton Schaffhausen Nein gesagt zu dieser Vorlage."
2964,49.3,49.3,50.7,"Stein am Rhein SH","Nein zu einer 13. AHV-Rente in Stein am Rhein. Die Gemeinde hat die Initiative mit 50,7 Prozent abgelehnt. Stein am Rhein hat damit gleich wie der Kanton Schaffhausen Nein gesagt zu dieser Vorlage."
2971,26.8,26.8,73.2,"Hallau SH","Keine Mehrheit für die Initiative für eine 13. AHV-Rente in Hallau: Mit 8'210 Nein-Stimmen zu 3'003 Ja-Stimmen oder 73,2 Prozent hat die Gemeinde das Volksbegehren verworfen. Hallau hat damit gleich wie der Kanton Schaffhausen Nein gesagt zu dieser Vorlage."
2972,66.5,66.5,33.5,"Oberhallau SH","Ja zur Initiative für eine 13. AHV-Rente in Oberhallau: Mit 66,5 Prozent haben die Stimmbürgerinnen und Stimmbürger das Volksbegehren angenommen. Oberhallau hat damit anders abgestimmt als der Kanton Schaffhausen, der die Vorlage abgelehnt hat."
2973,51.2,51.2,48.8,"Trasadingen SH","51,2 Prozent der Abstimmenden in der Gemeinde Trasadingen haben Ja gesagt zur Initiative für eine 13. AHV-Rente. Trasadingen hat damit anders abgestimmt als der Kanton Schaffhausen, der die Vorlage abgelehnt hat."
2974,37.1,37.1,62.9,"Wilchingen SH","Nein zur Initiative für eine 13. AHV-Rente in Wilchingen: Mit 7'377 Nein- zu 4'342 Ja-Stimmen haben die Stimmbürgerinnen und Stimmbürger das Volksbegehren abgelehnt. Das sind 62,9 Prozent. Wilchingen hat damit gleich wie der Kanton Schaffhausen Nein gesagt zu dieser Vorlage."
